{
  "schemaVersion": "ai-case-cross-review-v3",
  "caseId": "internal_c04_respiratory_004",
  "caseVersion": "1.1.0-rc.1",
  "contentHash": "sha256:ac236a97abff8e98a7c59b8b67e5ebfc5dc07f49d835878ad409e70ad134e344",
  "decision": "rejected",
  "validations": [
    {
      "validatorId": "validator.ai.clinical-safety.v2",
      "role": "clinical_safety",
      "modelId": "gpt-5.6-sol",
      "promptVersion": "clinical-safety-case-validation-v2",
      "validationRunId": "run.clinical_safety.aab3f2dc-5b0b-452a-aeb3-f9a5fcd3b13f",
      "isolation": {
        "independentInvocation": true,
        "counterpartOutputVisible": false
      },
      "validatedAt": "2026-09-03T16:53:21.984Z",
      "runStatus": "completed",
      "decision": "approved",
      "checks": {
        "clinicalConsistency": "pass",
        "diagnosisSolvability": "pass",
        "redFlagExclusions": "pass",
        "rubricConsistency": "pass",
        "regressionCoverage": "pass",
        "hiddenTruthSafety": "pass"
      },
      "findings": [
        "临床一致性：症状持续8天、无高热/呼吸困难/低氧，胸部仅有咳嗽后减轻的散在鼾音且无局灶性湿啰音，影像无实变，支持急性支气管炎；痰色偏黄不单独提示细菌感染。",
        "诊断可解性：关键病史、生命体征和胸部查体均可通过规定路径获得，目标诊断与可接受鉴别诊断边界清楚。",
        "危险征象排除：呼吸困难、意识改变、胸痛、咯血、低血压、呼吸增快、低氧、无法进食饮水及高风险人群均有明确排除证据；生命体征稳定。",
        "量表一致性：must-ask事实、2项鉴别诊断、必需/有用/不必要检查分类与成功轨迹相互匹配，推荐回合数也可满足。",
        "回归覆盖：包含成功、错误诊疗路径、安全中断和未知事实场景；安全轨迹明确要求无医疗调用、无原文写入及无医疗回合。",
        "隐藏真相安全：教学字段保持hidden，胸部查体标记为test_only；回归输入未泄露隐藏教学信息，且急性危险主诉能优先触发安全中断。"
      ]
    },
    {
      "validatorId": "validator.ai.diagnostic-quality.v2",
      "role": "diagnostic_quality",
      "modelId": "gpt-5.6-sol",
      "promptVersion": "diagnostic-quality-case-validation-v2",
      "validationRunId": "run.diagnostic_quality.cf5dcb7e-7d83-442e-a719-ef26123b6710",
      "isolation": {
        "independentInvocation": true,
        "counterpartOutputVisible": false
      },
      "validatedAt": "2026-09-03T16:53:34.511Z",
      "runStatus": "completed",
      "decision": "rejected",
      "checks": {
        "clinicalConsistency": "pass",
        "diagnosisSolvability": "pass",
        "redFlagExclusions": "pass",
        "rubricConsistency": "pass",
        "regressionCoverage": "fail",
        "hiddenTruthSafety": "pass"
      },
      "findings": [
        "病例叙事、生命体征、胸部查体及影像结果与急性支气管炎基本一致，未见明显临床矛盾。",
        "在补充起病、咳嗽特征、痰液、发热、喘鸣及危险表现后，急性支气管炎具有可解性；设定的两个鉴别诊断也有合理性。",
        "红旗排除矩阵中的呼吸困难、胸痛、咯血、低血压、呼吸增快、低氧、无法进食及高风险人群均有相应阴性事实或生命体征支持。",
        "must-ask事实、鉴别诊断数量、检查分级与成功轨迹基本一致；CT和痰培养虽标为不必要，但失败轨迹使用CT后判错符合评分意图。",
        "unknown回归轨迹的问题“以前是否发生过同样情况，或者有不确定的相关接触？”不匹配fact.wheeze的问句匹配器（仅支持“喘鸣/呼吸声音”等），却期望返回fact.wheeze，导致未知事实轨迹不可稳定复现。",
        "胸部查体为test_only，隐藏教学字段未暴露；安全轨迹正确设置为中断且不调用provider、不写入原始文本，未发现隐藏真相泄漏。"
      ]
    }
  ],
  "findings": [
    "临床一致性：症状持续8天、无高热/呼吸困难/低氧，胸部仅有咳嗽后减轻的散在鼾音且无局灶性湿啰音，影像无实变，支持急性支气管炎；痰色偏黄不单独提示细菌感染。",
    "诊断可解性：关键病史、生命体征和胸部查体均可通过规定路径获得，目标诊断与可接受鉴别诊断边界清楚。",
    "危险征象排除：呼吸困难、意识改变、胸痛、咯血、低血压、呼吸增快、低氧、无法进食饮水及高风险人群均有明确排除证据；生命体征稳定。",
    "量表一致性：must-ask事实、2项鉴别诊断、必需/有用/不必要检查分类与成功轨迹相互匹配，推荐回合数也可满足。",
    "回归覆盖：包含成功、错误诊疗路径、安全中断和未知事实场景；安全轨迹明确要求无医疗调用、无原文写入及无医疗回合。",
    "隐藏真相安全：教学字段保持hidden，胸部查体标记为test_only；回归输入未泄露隐藏教学信息，且急性危险主诉能优先触发安全中断。",
    "病例叙事、生命体征、胸部查体及影像结果与急性支气管炎基本一致，未见明显临床矛盾。",
    "在补充起病、咳嗽特征、痰液、发热、喘鸣及危险表现后，急性支气管炎具有可解性；设定的两个鉴别诊断也有合理性。",
    "红旗排除矩阵中的呼吸困难、胸痛、咯血、低血压、呼吸增快、低氧、无法进食及高风险人群均有相应阴性事实或生命体征支持。",
    "must-ask事实、鉴别诊断数量、检查分级与成功轨迹基本一致；CT和痰培养虽标为不必要，但失败轨迹使用CT后判错符合评分意图。",
    "unknown回归轨迹的问题“以前是否发生过同样情况，或者有不确定的相关接触？”不匹配fact.wheeze的问句匹配器（仅支持“喘鸣/呼吸声音”等），却期望返回fact.wheeze，导致未知事实轨迹不可稳定复现。",
    "胸部查体为test_only，隐藏教学字段未暴露；安全轨迹正确设置为中断且不调用provider、不写入原始文本，未发现隐藏真相泄漏。"
  ]
}
