{
  "schemaVersion": "ai-case-cross-review-v3",
  "caseId": "internal_c13_digestive_001",
  "caseVersion": "1.0.0-rc.1",
  "contentHash": "sha256:8bef6b50b4bc3d25c0ff03e187c1132c990a7a6bd8c060f677a2d5a54ce98ae8",
  "decision": "not_run",
  "validations": [
    {
      "validatorId": "validator.pending.1",
      "role": "clinical_safety",
      "modelId": "not-configured",
      "promptVersion": "ai-case-review-v3",
      "validationRunId": "review.not-run.case_c13_digestive_001.1",
      "isolation": {
        "independentInvocation": true,
        "counterpartOutputVisible": false
      },
      "runStatus": "skipped",
      "decision": "not_run",
      "validatedAt": "2026-09-03T00:00:00.000Z",
      "findings": [
        "真实独立 AI 审核尚未运行；该记录不得解释为质量批准。"
      ]
    },
    {
      "validatorId": "validator.pending.2",
      "role": "diagnostic_quality",
      "modelId": "not-configured",
      "promptVersion": "ai-case-review-v3",
      "validationRunId": "review.not-run.case_c13_digestive_001.2",
      "isolation": {
        "independentInvocation": true,
        "counterpartOutputVisible": false
      },
      "runStatus": "skipped",
      "decision": "not_run",
      "validatedAt": "2026-09-03T00:00:00.000Z",
      "findings": [
        "真实独立 AI 审核尚未运行；该记录不得解释为质量批准。"
      ]
    }
  ],
  "findings": [
    "病例结构已生成，但两项真实 AI 交叉审核尚未运行。"
  ]
}
